{"$schema":"https://json-schema.org/draft/2020-12/schema","$id":"https://github.com/timerloggedout-spec/termux-monorepo/blob/master/docs/ops/corpus/EXPERIMENT.schema.json","title":"DOE/MVT Experiment Record","type":"object","additionalProperties":false,"required":["schema_version","experiment_id","observed_at","baseline_sha","candidate_sha","suite","treatment","status","provenance","confidence"],"properties":{"schema_version":{"const":"1.0"},"experiment_id":{"type":"string"},"observed_at":{"type":"string","format":"date-time"},"baseline_sha":{"type":"string","pattern":"^[0-9a-f]{40}$"},"candidate_sha":{"type":"string","pattern":"^[0-9a-f]{40}$"},"merge_base_sha":{"type":["string","null"],"pattern":"^(null|[0-9a-f]{40})$"},"suite":{"type":"string"},"cohort":{"type":["string","null"]},"treatment":{"type":"object","additionalProperties":false,"required":["manager_policy_id"],"properties":{"manager_policy_id":{"type":"string"},"provider":{"type":["string","null"]},"model":{"type":["string","null"]},"arm":{"type":["string","null"]},"instance":{"type":["object","null"],"additionalProperties":false,"required":["provider","model","system_prompt","tools","role","moniker","context","instance_key"],"properties":{"provider":{"type":"string"},"model":{"type":"string","description":"model@version, verbatim"},"system_prompt":{"type":"object","additionalProperties":false,"required":["ref","sha256"],"properties":{"ref":{"type":"string","description":"repo path or prompt:<moniker>:<slug>"},"sha256":{"type":"string","pattern":"^[0-9a-f]{64}$"}}},"tools":{"type":"object","additionalProperties":false,"required":["ref","sha256"],"properties":{"ref":{"type":"string","description":"repo path to tool manifest or tools:<moniker>:<slug>"},"sha256":{"type":"string","pattern":"^[0-9a-f]{64}$"}}},"role":{"type":"string"},"moniker":{"type":"string"},"context":{"type":"string"},"instance_key":{"type":"string","pattern":"^[0-9a-f]{64}$","description":"sha256 of canonical instance tuple per scripts/doe/instance_key.py"}}}}},"status":{"type":"string","enum":["observed","running","passed","failed","skipped","blocked","superseded"]},"outcome":{"type":["string","null"]},"metrics":{"type":"object","additionalProperties":{"type":["number","integer","string","null"]}},"provenance":{"type":"string","enum":["github","linear","notion","hex","vercel","forensic","manual","other"]},"confidence":{"type":"string","enum":["high","medium","low"]},"evidence_refs":{"type":"array","items":{"type":"string","format":"uri"}}}}
