{
 "schema_version": "1.0",
 "experiment_id": "doe-pilot-1-bounded-search-compressed-t3",
 "observed_at": "2026-10-28T00:04:27Z",
 "baseline_sha": "5ce1a9c233ef56b958c60099b94467273326f1c1",
 "candidate_sha": "5ce1a9c233ef56b958c60099b94467273326f1c1",
 "merge_base_sha": null,
 "suite": "doe-family:pilot-1-context-routing-x-compression",
 "cohort": "harness-design/easy",
 "treatment": {
  "manager_policy_id": "doe-expert/pilot-1-runner/v1",
  "provider": null,
  "model": null,
  "arm": "bounded-search/compressed"
 },
 "status": "passed",
 "outcome": "accuracy=1.000 task=t3 retrieved=docs/ops/ATES-ORCHESTRATOR-DOE-MVT.md target=docs/ops/ATES-ORCHESTRATOR-DOE-MVT.md",
 "metrics": {
  "accuracy": 1.0,
  "input_tokens": 245,
  "elapsed_ms": 118.183,
  "rework": 0
 },
 "provenance": "manual",
 "confidence": "high",
 "evidence_refs": [
  "https://github.com/timerloggedout-spec/termux-monorepo/blob/master/experiments/doe/pilot-1-context-routing-x-compression/DESIGN.json"
 ]
}
